{
  "contract_version": "1.0.0",
  "block_id": "BLK-O-0600",
  "start_time": "06:00",
  "end_time": "07:00",
  "duration_minutes": 60,
  "direction": "outbound",
  "observed_passengers": 70,
  "demand_rate_per_hour": 70,
  "source_interval_ids": ["OBS-O-0600"],
  "source_resolution_type": "regular_interval",
  "source_resolution_minutes": 60,
  "block_mode": "native",
  "aggregation_method": "none",
  "confidence": "high",
  "interpolation_status": "none",
  "observation_days": 5,
  "sample_count": 5,
  "block_boundary_reason": "source_boundary"
}
